{
  "schemaVersion": "0.1.0",
  "id": "reference-lift-maintenance",
  "buildingId": "reference-medical-centre",
  "packageHash": "386a43f4b6094d9608b8a5ab822bd2a918c01098d7d78d672744d5767b0c41a4",
  "validFrom": "2026-07-01T00:00:00.000Z",
  "validUntil": "2026-08-01T00:00:00.000Z",
  "closures": [
    {
      "id": "close-east-lift",
      "target": {
        "type": "source",
        "id": "lift-east"
      },
      "reason": "Planned lift maintenance"
    }
  ]
}
